{
  "schema": "shellx-motion/tracking-analysis@1",
  "id": "track_similarity_known",
  "source": {
    "assetId": "footage_similarity",
    "sha256": "aaaaaaaaaaaaaaaaaaaaaaaaaaaaaaaaaaaaaaaaaaaaaaaaaaaaaaaaaaaaaaaa",
    "byteLength": 4096,
    "width": 640,
    "height": 360,
    "durationMs": 400
  },
  "mode": "planar",
  "model": "similarity",
  "status": "partial",
  "reference": {
    "atMs": 0,
    "bounds": { "x": 220, "y": 120, "width": 200, "height": 120 },
    "points": [
      { "x": 220, "y": 120 },
      { "x": 420, "y": 120 },
      { "x": 420, "y": 240 },
      { "x": 220, "y": 240 }
    ]
  },
  "settings": {
    "startMs": 0,
    "endMs": 400,
    "stepMs": 100,
    "direction": "forward",
    "searchRadiusPx": 32,
    "pyramidLevels": 3,
    "maxIterations": 40,
    "confidenceFloor": 0.75,
    "deterministicSeed": 42
  },
  "settingsSha256": "678cb3ea4e9bd55be901303158e134ec8507346ccf681863c45dc5e52f6a80f0",
  "solver": {
    "id": "shellx-fixed-planar-tracker",
    "version": "1.0.0",
    "implementationSha256": "dddddddddddddddddddddddddddddddddddddddddddddddddddddddddddddddd"
  },
  "samples": [
    { "atMs": 0, "state": "tracked", "confidence": 0.99, "residualErrorPx": 0, "matrix": [1, 0, 0, 0, 1, 0, 0, 0, 1] },
    { "atMs": 100, "state": "tracked", "confidence": 0.94, "residualErrorPx": 0.3, "matrix": [1, 0, 10, 0, 1, 5, 0, 0, 1] },
    { "atMs": 200, "state": "low-confidence", "confidence": 0.52, "residualErrorPx": 6.2, "matrix": [1, 0, 16, 0, 1, 7, 0, 0, 1] },
    { "atMs": 300, "state": "lost", "confidence": 0.1 },
    { "atMs": 400, "state": "recovered", "confidence": 0.87, "residualErrorPx": 1.1, "matrix": [1.0340481406628184, -0.18233058655027687, 41.92410056694795, 0.18233058655027687, 1.0340481406628184, -70.47445301539591, 0, 0, 1] }
  ],
  "spans": [
    { "startMs": 200, "endMs": 200, "state": "low-confidence", "minConfidence": 0.52, "maxResidualErrorPx": 6.2 },
    { "startMs": 300, "endMs": 300, "state": "lost", "minConfidence": 0.1 },
    { "startMs": 400, "endMs": 400, "state": "recovered", "minConfidence": 0.87, "maxResidualErrorPx": 1.1 }
  ],
  "createdAt": "2026-07-13T21:00:00.000Z"
}
